{
  "schema": "athena.module.manifest",
  "schemaVersion": "1.0",
  "id": "key-custody",
  "name": "Key Custody",
  "version": "1.2.0",
  "kind": "security-service",
  "owner": "security",
  "criticality": "critical",
  "runtimeRole": "key-custody",
  "sourcePaths": [
    "server/key-custody.js",
    "server/utils/security/keyCustody/",
    "server/utils/security/keyLifecycle.js"
  ],
  "capabilities": [
    "remote-wrap",
    "remote-unwrap",
    "remote-audit-signing",
    "rotation",
    "quarantine",
    "crypto-suite-registry"
  ],
  "routes": {
    "public": [],
    "internal": [
      "/internal/v1/keys/wrap",
      "/internal/v1/keys/unwrap",
      "/internal/v1/keys/audit-descriptor",
      "/internal/v1/keys/audit-sign",
      "/internal/v1/keys/status"
    ]
  },
  "rpc": {
    "provides": [
      "key-custody.wrap",
      "key-custody.unwrap",
      "key-custody.audit-descriptor",
      "key-custody.audit-sign"
    ],
    "consumes": []
  },
  "events": {
    "publishes": ["key-custody.rotation.*", "key-custody.quarantine.*"],
    "subscribes": []
  },
  "data": { "schemas": ["key_custody"], "objectPrefixes": [] },
  "security": {
    "serviceIdentity": "spiffe://athena/{environment}/key-custody",
    "keyDomains": [
      "platform",
      "audit",
      "data",
      "file",
      "agent",
      "browser-profile"
    ],
    "allowedCallers": [
      "authentication",
      "athena-api",
      "chat-runtime",
      "agent-runtime",
      "model-gateway",
      "tool-runtime",
      "crypto-account-access",
      "crypto-forecast",
      "knowledge-ingest",
      "rag",
      "browser-plane",
      "browser-worker"
    ],
    "failureMode": "fail-closed",
    "principalFreshnessMs": 10000
  },
  "deployment": {
    "image": "athena/key-custody",
    "healthPath": "/live",
    "readinessPath": "/ready",
    "drainPath": "/internal/drain",
    "availabilityTarget": 0.999,
    "reconnectP95Ms": 0
  },
  "dependsOn": ["infra:postgresql"]
}
